1, Áo Thun Tay Ngắn, M, White, 100% Cotton, 11-04-2023 15:00:02, 1600000
2, Áo Thun Tay Dài, L, Grey, 80% Cotton and 20% Polyester, 10-04-2023 08:05:20. 1800000
3, Quần Dài Cargo, XL, Black, Baggy fit and Unisex, 01-02-2022 11:23:50, 4500000
4, Quần Short, S, Orange, Back welt pocket with zip closure, 20-12-2022 13:35:20, 1850000
5, Mũ Lưỡi Trai, One Size, Black and Red, One Size and Unisex, 31-10-2022 15:45:11, 1030000
6, Kính, One Size,Light Yellow and Black, Simple Disign ,11-04-2023 17:02:40, 3050000
7, Hoodie, XL, Black, Form OverSize, 20-02-2023 19:09:20, 3765000